{"contract_version":"watchdog.ingestion-adapter.v1","id":"watchdog.native-event-adapter","version":"1","source_type":"native","input_protocol":"watchdog.native-event.v1","output_schema":"watchdog.telemetry.v2","content_default":"off","supported_kinds":["model","agent","tool","handoff","retrieval","workflow","approval","execution","evaluation","internal"],"dependency_requirements":[],"source_id_namespace":"producer-defined","failure_isolation":"fail-open"}
