{"contract_version":"watchdog.ingestion-adapter.v1","id":"watchdog.openai-compatible-proxy","version":"1","source_type":"proxy","input_protocol":"OpenAI-compatible HTTP","output_schema":"watchdog.telemetry.v2","content_default":"off","supported_kinds":["model","tool","error"],"dependency_requirements":[],"source_id_namespace":"watchdog-proxy","failure_isolation":"fail-open"}
