{"contract_version":"watchdog.ingestion-adapter.v1","id":"watchdog.otlp-json-ingest","version":"1","source_type":"otlp","input_protocol":"OTLP/HTTP JSON traces (AI-relevant subset)","output_schema":"watchdog.telemetry.v2","content_default":"off","supported_kinds":["model","agent","tool","retrieval","workflow","evaluation","internal"],"dependency_requirements":[],"source_id_namespace":"W3C trace context","failure_isolation":"fail-open"}
